<!ELEMENT VOCATIONS (TYPE+)>
<!ELEMENT TYPE (VOCATION+)>
<!ELEMENT VOCATION (NOM,DESCRIPTION,PERKS+, TAGS?)>
<!ELEMENT PERKS (NOM,DESCRIPTION,ORDRE, TAGS?)>
<!ELEMENT ORDRE (NOM,DESCRIPTION, LEGALITE, JETS?, TAGS?)>
<!ELEMENT JETS (JET+)>
<!ELEMENT JET (COUT-PV?, COUT-ARGENT?, DESCRIPTION?, ((CARACTERISTIQUE, COMPETENCE, POTENTIEL, DIFFICULTE, CARACTERISTIQUE-OPOSEE?)|AUTOMATIQUE))>


<!ATTLIST TYPE name CDATA #REQUIRED>
<!ATTLIST PERKS niveau CDATA #REQUIRED>


<!ELEMENT NOM (#PCDATA)>
<!ELEMENT DESCRIPTION (#PCDATA)>
<!ELEMENT CARACTERISTIQUE (#PCDATA)>
<!ELEMENT CARACTERISTIQUE-OPOSEE (#PCDATA)>
<!ELEMENT COMPETENCE (#PCDATA)>
<!ELEMENT COUT-PV (#PCDATA)>
<!ELEMENT COUT-ARGENT (#PCDATA)>
<!ELEMENT POTENTIEL (#PCDATA)>
<!ELEMENT DIFFICULTE (#PCDATA)>
<!ELEMENT AUTOMATIQUE (#PCDATA)>
<!ELEMENT LEGALITE (#PCDATA)>

<!ELEMENT TAGS (TAG+)>
<!ELEMENT TAG (#PCDATA)>


